Bus Hound 7.00 capture. Complements of www.perisoft.net

Bus Hound Capture

  Device - Device ID (followed by the endpoint for USB devices)
            (20) LVNext Camera
            (21) LVNext Hello Camera
  Phase  - Phase Type
            CTL   USB control transfer       
            IN    Data in transfer           
            OUT   Data out transfer          
            USTS  USB status                 
  Data   - Hex dump of the data transferred
  Descr  - Description of the phase
  Cmd... - Position in the captured data


Device  Phase  Data                                                Description       Cmd.Phase.Ofs(rep)
------  -----  --------------------------------------------------  ----------------  ------------------
  20.0  CTL    80 06 00 01  00 00 12 00                            GET DESCRIPTOR           1.1.0        
  20.0  IN     12 01 20 03  ef 02 01 09  6d 04 4f 09  99 99 01 05  .. .....m.O.....         1.2.0        
               03 01                                               ..                       1.2.16       
  20.0  CTL    80 06 00 02  00 00 09 00                            GET DESCRIPTOR           2.1.0        
  20.0  IN     09 02 e4 05  02 01 04 c0  00                        .........                2.2.0        
  20.0  CTL    80 06 00 02  00 00 e4 05                            GET DESCRIPTOR           3.1.0        
  20.0  IN     09 02 e4 05  02 01 04 c0  00 09 04 00  00 00 0e 01  ................         3.2.0        
               00 05 0d 24  01 50 01 2a  01 00 6c dc  02 01 01 12  ...$.P.*..l.....         3.2.16       
  20.0  CTL    00 09 01 00  00 00 00 00                            SET CONFIG               4.1.0        
  20.0  CTL    01 0b 00 00  01 00 00 00                            SET INTERFACE            5.1.0        
  20.0  CTL    a1 86 00 04  00 01 01 00                            GET INFO                 6.1.0        
  20.0  IN     0f                                                  .                        6.2.0        
  20.0  CTL    a1 82 00 04  00 01 04 00                            GET MIN                  7.1.0        
  20.0  IN     03 00 00 00                                         ....                     7.2.0        
  20.0  CTL    a1 83 00 04  00 01 04 00                            GET MAX                  8.1.0        
  20.0  IN     ff 07 00 00                                         ....                     8.2.0        
  20.0  CTL    a1 84 00 04  00 01 04 00                            GET RES                  9.1.0        
  20.0  IN     01 00 00 00                                         ....                     9.2.0        
  20.0  CTL    a1 87 00 04  00 01 04 00                            GET DEF                 10.1.0        
  20.0  IN     9c 00 00 00                                         ....                    10.2.0        
  20.0  CTL    a1 82 00 04  00 01 04 00                            GET MIN                 11.1.0        
  20.0  IN     03 00 00 00                                         ....                    11.2.0        
  20.0  CTL    a1 83 00 04  00 01 04 00                            GET MAX                 12.1.0        
  20.0  IN     ff 07 00 00                                         ....                    12.2.0        
  20.0  CTL    a1 84 00 04  00 01 04 00                            GET RES                 13.1.0        
  20.0  IN     01 00 00 00                                         ....                    13.2.0        
  20.0  CTL    a1 86 00 03  00 01 01 00                            GET INFO                14.1.0        
  20.0  IN     03                                                  .                       14.2.0        
  20.0  CTL    a1 82 00 03  00 01 01 00                            GET MIN                 15.1.0        
  20.0  USTS   c0000004                                            stall pid               15.2.0        
  20.0  CTL    a1 81 00 02  00 00 01 00                            GET CUR                 16.1.0        
  20.0  IN     07                                                  .                       16.2.0        
  20.0  CTL    a1 83 00 03  00 01 01 00                            GET MAX                 17.1.0        
  20.0  USTS   c0000004                                            stall pid               17.2.0        
  20.0  CTL    a1 81 00 02  00 00 01 00                            GET CUR                 18.1.0        
  20.0  IN     07                                                  .                       18.2.0        
  20.0  CTL    a1 84 00 03  00 01 01 00                            GET RES                 19.1.0        
  20.0  USTS   c0000004                                            stall pid               19.2.0        
  20.0  CTL    a1 81 00 02  00 00 01 00                            GET CUR                 20.1.0        
  20.0  IN     07                                                  .                       20.2.0        
  20.0  CTL    a1 87 00 03  00 01 01 00                            GET DEF                 21.1.0        
  20.0  USTS   c0000004                                            stall pid               21.2.0        
  20.0  CTL    a1 81 00 02  00 00 01 00                            GET CUR                 22.1.0        
  20.0  IN     07                                                  .                       22.2.0        
  20.0  CTL    a1 86 00 09  00 01 01 00                            GET INFO                23.1.0        
  20.0  USTS   c0000004                                            stall pid               23.2.0        
  20.0  CTL    a1 81 00 02  00 00 01 00                            GET CUR                 24.1.0        
  20.0  IN     06                                                  .                       24.2.0        
  20.0  CTL    a1 86 00 06  00 01 01 00                            GET INFO                25.1.0        
  20.0  IN     0f                                                  .                       25.2.0        
  20.0  CTL    a1 82 00 06  00 01 02 00                            GET MIN                 26.1.0        
  20.0  IN     00 00                                               ..                      26.2.0        
  20.0  CTL    a1 83 00 06  00 01 02 00                            GET MAX                 27.1.0        
  20.0  IN     ff 03                                               ..                      27.2.0        
  20.0  CTL    a1 84 00 06  00 01 02 00                            GET RES                 28.1.0        
  20.0  IN     01 00                                               ..                      28.2.0        
  20.0  CTL    a1 87 00 06  00 01 02 00                            GET DEF                 29.1.0        
  20.0  IN     f4 01                                               ..                      29.2.0        
  20.0  CTL    a1 86 00 0b  00 01 01 00                            GET INFO                30.1.0        
  20.0  IN     03                                                  .                       30.2.0        
  20.0  CTL    a1 82 00 0b  00 01 02 00                            GET MIN                 31.1.0        
  20.0  IN     64 00                                               d.                      31.2.0        
  20.0  CTL    a1 83 00 0b  00 01 02 00                            GET MAX                 32.1.0        
  20.0  IN     90 01                                               ..                      32.2.0        
  20.0  CTL    a1 84 00 0b  00 01 02 00                            GET RES                 33.1.0        
  20.0  IN     01 00                                               ..                      33.2.0        
  20.0  CTL    a1 87 00 0b  00 01 02 00                            GET DEF                 34.1.0        
  20.0  IN     64 00                                               d.                      34.2.0        
  20.0  CTL    a1 86 00 0d  00 01 01 00                            GET INFO                35.1.0        
  20.0  IN     03                                                  .                       35.2.0        
  20.0  CTL    a1 82 00 0d  00 01 08 00                            GET MIN                 36.1.0        
  20.0  IN     60 73 ff ff  60 73 ff ff                            `s..`s..                36.2.0        
  20.0  CTL    a1 83 00 0d  00 01 08 00                            GET MAX                 37.1.0        
  20.0  IN     a0 8c 00 00  a0 8c 00 00                            ........                37.2.0        
  20.0  CTL    a1 84 00 0d  00 01 08 00                            GET RES                 38.1.0        
  20.0  IN     10 0e 00 00  10 0e 00 00                            ........                38.2.0        
  20.0  CTL    a1 87 00 0d  00 01 08 00                            GET DEF                 39.1.0        
  20.0  IN     00 00 00 00  00 00 00 00                            ........                39.2.0        
  20.0  CTL    a1 86 00 01  00 01 01 00                            GET INFO                40.1.0        
  20.0  IN     03                                                  .                       40.2.0        
  20.0  CTL    a1 82 00 01  00 01 01 00                            GET MIN                 41.1.0        
  20.0  USTS   c0000004                                            stall pid               41.2.0        
  20.0  CTL    a1 81 00 02  00 00 01 00                            GET CUR                 42.1.0        
  20.0  IN     07                                                  .                       42.2.0        
  20.0  CTL    a1 83 00 01  00 01 01 00                            GET MAX                 43.1.0        
  20.0  USTS   c0000004                                            stall pid               43.2.0        
  20.0  CTL    a1 81 00 02  00 00 01 00                            GET CUR                 44.1.0        
  20.0  IN     07                                                  .                       44.2.0        
  20.0  CTL    a1 84 00 01  00 01 01 00                            GET RES                 45.1.0        
  20.0  USTS   c0000004                                            stall pid               45.2.0        
  20.0  CTL    a1 81 00 02  00 00 01 00                            GET CUR                 46.1.0        
  20.0  IN     07                                                  .                       46.2.0        
  20.0  CTL    a1 87 00 01  00 01 01 00                            GET DEF                 47.1.0        
  20.0  USTS   c0000004                                            stall pid               47.2.0        
  20.0  CTL    a1 81 00 02  00 00 01 00                            GET CUR                 48.1.0        
  20.0  IN     07                                                  .                       48.2.0        
  20.0  CTL    a1 86 00 02  00 03 01 00                            GET INFO                49.1.0        
  20.0  IN     03                                                  .                       49.2.0        
  20.0  CTL    a1 82 00 02  00 03 02 00                            GET MIN                 50.1.0        
  20.0  IN     00 00                                               ..                      50.2.0        
  20.0  CTL    a1 83 00 02  00 03 02 00                            GET MAX                 51.1.0        
  20.0  IN     ff 00                                               ..                      51.2.0        
  20.0  CTL    a1 84 00 02  00 03 02 00                            GET RES                 52.1.0        
  20.0  IN     01 00                                               ..                      52.2.0        
  20.0  CTL    a1 87 00 02  00 03 02 00                            GET DEF                 53.1.0        
  20.0  IN     80 00                                               ..                      53.2.0        
  20.0  CTL    a1 86 00 03  00 03 01 00                            GET INFO                54.1.0        
  20.0  IN     03                                                  .                       54.2.0        
  20.0  CTL    a1 82 00 03  00 03 02 00                            GET MIN                 55.1.0        
  20.0  IN     00 00                                               ..                      55.2.0        
  20.0  CTL    a1 83 00 03  00 03 02 00                            GET MAX                 56.1.0        
  20.0  IN     ff 00                                               ..                      56.2.0        
  20.0  CTL    a1 84 00 03  00 03 02 00                            GET RES                 57.1.0        
  20.0  IN     01 00                                               ..                      57.2.0        
  20.0  CTL    a1 87 00 03  00 03 02 00                            GET DEF                 58.1.0        
  20.0  IN     80 00                                               ..                      58.2.0        
  20.0  CTL    a1 86 00 07  00 03 01 00                            GET INFO                59.1.0        
  20.0  IN     03                                                  .                       59.2.0        
  20.0  CTL    a1 82 00 07  00 03 02 00                            GET MIN                 60.1.0        
  20.0  IN     00 00                                               ..                      60.2.0        
  20.0  CTL    a1 83 00 07  00 03 02 00                            GET MAX                 61.1.0        
  20.0  IN     ff 00                                               ..                      61.2.0        
  20.0  CTL    a1 84 00 07  00 03 02 00                            GET RES                 62.1.0        
  20.0  IN     01 00                                               ..                      62.2.0        
  20.0  CTL    a1 87 00 07  00 03 02 00                            GET DEF                 63.1.0        
  20.0  IN     80 00                                               ..                      63.2.0        
  20.0  CTL    a1 86 00 08  00 03 01 00                            GET INFO                64.1.0        
  20.0  IN     03                                                  .                       64.2.0        
  20.0  CTL    a1 82 00 08  00 03 02 00                            GET MIN                 65.1.0        
  20.0  IN     00 00                                               ..                      65.2.0        
  20.0  CTL    a1 83 00 08  00 03 02 00                            GET MAX                 66.1.0        
  20.0  IN     ff 00                                               ..                      66.2.0        
  20.0  CTL    a1 84 00 08  00 03 02 00                            GET RES                 67.1.0        
  20.0  IN     01 00                                               ..                      67.2.0        
  20.0  CTL    a1 87 00 08  00 03 02 00                            GET DEF                 68.1.0        
  20.0  IN     80 00                                               ..                      68.2.0        
  20.0  CTL    a1 86 00 0a  00 03 01 00                            GET INFO                69.1.0        
  20.0  IN     0f                                                  .                       69.2.0        
  20.0  CTL    a1 82 00 0a  00 03 02 00                            GET MIN                 70.1.0        
  20.0  IN     d0 07                                               ..                      70.2.0        
  20.0  CTL    a1 83 00 0a  00 03 02 00                            GET MAX                 71.1.0        
  20.0  IN     4c 1d                                               L.                      71.2.0        
  20.0  CTL    a1 84 00 0a  00 03 02 00                            GET RES                 72.1.0        
  20.0  IN     01 00                                               ..                      72.2.0        
  20.0  CTL    a1 87 00 0a  00 03 02 00                            GET DEF                 73.1.0        
  20.0  IN     a0 0f                                               ..                      73.2.0        
  20.0  CTL    a1 86 00 01  00 03 01 00                            GET INFO                74.1.0        
  20.0  IN     03                                                  .                       74.2.0        
  20.0  CTL    a1 82 00 01  00 03 02 00                            GET MIN                 75.1.0        
  20.0  IN     00 00                                               ..                      75.2.0        
  20.0  CTL    a1 83 00 01  00 03 02 00                            GET MAX                 76.1.0        
  20.0  IN     01 00                                               ..                      76.2.0        
  20.0  CTL    a1 84 00 01  00 03 02 00                            GET RES                 77.1.0        
  20.0  IN     01 00                                               ..                      77.2.0        
  20.0  CTL    a1 87 00 01  00 03 02 00                            GET DEF                 78.1.0        
  20.0  IN     00 00                                               ..                      78.2.0        
  20.0  CTL    a1 86 00 04  00 03 01 00                            GET INFO                79.1.0        
  20.0  IN     0f                                                  .                       79.2.0        
  20.0  CTL    a1 82 00 04  00 03 02 00                            GET MIN                 80.1.0        
  20.0  IN     00 00                                               ..                      80.2.0        
  20.0  CTL    a1 83 00 04  00 03 02 00                            GET MAX                 81.1.0        
  20.0  IN     ff 00                                               ..                      81.2.0        
  20.0  CTL    a1 84 00 04  00 03 02 00                            GET RES                 82.1.0        
  20.0  IN     01 00                                               ..                      82.2.0        
  20.0  CTL    a1 87 00 04  00 03 02 00                            GET DEF                 83.1.0        
  20.0  IN     00 00                                               ..                      83.2.0        
  20.0  CTL    a1 86 00 05  00 03 01 00                            GET INFO                84.1.0        
  20.0  IN     03                                                  .                       84.2.0        
  20.0  CTL    a1 82 00 05  00 03 01 00                            GET MIN                 85.1.0        
  20.0  IN     00                                                  .                       85.2.0        
  20.0  CTL    a1 83 00 05  00 03 01 00                            GET MAX                 86.1.0        
  20.0  IN     02                                                  .                       86.2.0        
  20.0  CTL    a1 84 00 05  00 03 01 00                            GET RES                 87.1.0        
  20.0  IN     01                                                  .                       87.2.0        
  20.0  CTL    a1 87 00 05  00 03 01 00                            GET DEF                 88.1.0        
  20.0  IN     02                                                  .                       88.2.0        
  20.0  CTL    a1 85 00 01  00 06 02 00                            GET LEN                 89.1.0        
  20.0  IN     08 00                                               ..                      89.2.0        
  20.0  CTL    a1 86 00 01  00 06 01 00                            GET INFO                90.1.0        
  20.0  IN     03                                                  .                       90.2.0        
  20.0  CTL    a1 82 00 01  00 06 08 00                            GET MIN                 91.1.0        
  20.0  IN     00                                                  .                       91.2.0        
  20.0  CTL    a1 83 00 01  00 06 08 00                            GET MAX                 92.1.0        
  20.0  IN     01 00                                               ..                      92.2.0        
  20.0  CTL    a1 84 00 01  00 06 08 00                            GET RES                 93.1.0        
  20.0  IN     01 00                                               ..                      93.2.0        
  20.0  CTL    a1 87 00 01  00 06 08 00                            GET DEF                 94.1.0        
  20.0  IN     00 00                                               ..                      94.2.0        
  20.0  CTL    a1 85 00 02  00 06 02 00                            GET LEN                 95.1.0        
  20.0  IN     08 00                                               ..                      95.2.0        
  20.0  CTL    a1 86 00 02  00 06 01 00                            GET INFO                96.1.0        
  20.0  IN     03                                                  .                       96.2.0        
  20.0  CTL    a1 82 00 02  00 06 08 00                            GET MIN                 97.1.0        
  20.0  IN     00                                                  .                       97.2.0        
  20.0  CTL    a1 83 00 02  00 06 08 00                            GET MAX                 98.1.0        
  20.0  IN     01 00                                               ..                      98.2.0        
  20.0  CTL    a1 84 00 02  00 06 08 00                            GET RES                 99.1.0        
  20.0  IN     01 00                                               ..                      99.2.0        
  20.0  CTL    a1 87 00 02  00 06 08 00                            GET DEF                100.1.0        
  20.0  IN     00 00                                               ..                     100.2.0        
  20.0  CTL    a1 85 00 03  00 06 02 00                            GET LEN                101.1.0        
  20.0  IN     20 00                                                .                     101.2.0        
  20.0  CTL    a1 86 00 03  00 06 01 00                            GET INFO               102.1.0        
  20.0  IN     03                                                  .                      102.2.0        
  20.0  CTL    a1 82 00 03  00 06 20 00                            GET MIN                103.1.0        
  20.0  IN     00                                                  .                      103.2.0        
  20.0  CTL    a1 83 00 03  00 06 20 00                            GET MAX                104.1.0        
  20.0  IN     01 00                                               ..                     104.2.0        
  20.0  CTL    a1 84 00 03  00 06 20 00                            GET RES                105.1.0        
  20.0  IN     01 00                                               ..                     105.2.0        
  20.0  CTL    a1 87 00 03  00 06 20 00                            GET DEF                106.1.0        
  20.0  IN     00 00                                               ..                     106.2.0        
  20.0  CTL    a1 85 00 04  00 06 02 00                            GET LEN                107.1.0        
  20.0  IN     08 00                                               ..                     107.2.0        
  20.0  CTL    a1 86 00 04  00 06 01 00                            GET INFO               108.1.0        
  20.0  IN     03                                                  .                      108.2.0        
  20.0  CTL    a1 82 00 04  00 06 08 00                            GET MIN                109.1.0        
  20.0  IN     00                                                  .                      109.2.0        
  20.0  CTL    a1 83 00 04  00 06 08 00                            GET MAX                110.1.0        
  20.0  IN     01 00                                               ..                     110.2.0        
  20.0  CTL    a1 84 00 04  00 06 08 00                            GET RES                111.1.0        
  20.0  IN     01 00                                               ..                     111.2.0        
  20.0  CTL    a1 87 00 04  00 06 08 00                            GET DEF                112.1.0        
  20.0  IN     00 00                                               ..                     112.2.0        
  20.0  CTL    a1 85 00 05  00 06 02 00                            GET LEN                113.1.0        
  20.0  IN     08 00                                               ..                     113.2.0        
  20.0  CTL    a1 86 00 05  00 06 01 00                            GET INFO               114.1.0        
  20.0  IN     03                                                  .                      114.2.0        
  20.0  CTL    a1 82 00 05  00 06 08 00                            GET MIN                115.1.0        
  20.0  IN     00                                                  .                      115.2.0        
  20.0  CTL    a1 83 00 05  00 06 08 00                            GET MAX                116.1.0        
  20.0  IN     01 00                                               ..                     116.2.0        
  20.0  CTL    a1 84 00 05  00 06 08 00                            GET RES                117.1.0        
  20.0  IN     01 00                                               ..                     117.2.0        
  20.0  CTL    a1 87 00 05  00 06 08 00                            GET DEF                118.1.0        
  20.0  IN     00 00                                               ..                     118.2.0        
  20.0  CTL    a1 85 00 06  00 06 02 00                            GET LEN                119.1.0        
  20.0  IN     10 00                                               ..                     119.2.0        
  20.0  CTL    a1 86 00 06  00 06 01 00                            GET INFO               120.1.0        
  20.0  IN     03                                                  .                      120.2.0        
  20.0  CTL    a1 82 00 06  00 06 10 00                            GET MIN                121.1.0        
  20.0  IN     00                                                  .                      121.2.0        
  20.0  CTL    a1 83 00 06  00 06 10 00                            GET MAX                122.1.0        
  20.0  IN     01 00                                               ..                     122.2.0        
  20.0  CTL    a1 84 00 06  00 06 10 00                            GET RES                123.1.0        
  20.0  IN     01 00                                               ..                     123.2.0        
  20.0  CTL    a1 87 00 06  00 06 10 00                            GET DEF                124.1.0        
  20.0  IN     00 00                                               ..                     124.2.0        
  20.0  CTL    a1 85 00 07  00 06 02 00                            GET LEN                125.1.0        
  20.0  IN     10 00                                               ..                     125.2.0        
  20.0  CTL    a1 86 00 07  00 06 01 00                            GET INFO               126.1.0        
  20.0  IN     03                                                  .                      126.2.0        
  20.0  CTL    a1 82 00 07  00 06 10 00                            GET MIN                127.1.0        
  20.0  IN     00                                                  .                      127.2.0        
  20.0  CTL    a1 83 00 07  00 06 10 00                            GET MAX                128.1.0        
  20.0  IN     01 00                                               ..                     128.2.0        
  20.0  CTL    a1 84 00 07  00 06 10 00                            GET RES                129.1.0        
  20.0  IN     01 00                                               ..                     129.2.0        
  20.0  CTL    a1 87 00 07  00 06 10 00                            GET DEF                130.1.0        
  20.0  IN     00 00                                               ..                     130.2.0        
  20.0  CTL    a1 85 00 08  00 06 02 00                            GET LEN                131.1.0        
  20.0  IN     10 00                                               ..                     131.2.0        
  20.0  CTL    a1 86 00 08  00 06 01 00                            GET INFO               132.1.0        
  20.0  IN     03                                                  .                      132.2.0        
  20.0  CTL    a1 82 00 08  00 06 10 00                            GET MIN                133.1.0        
  20.0  IN     00                                                  .                      133.2.0        
  20.0  CTL    a1 83 00 08  00 06 10 00                            GET MAX                134.1.0        
  20.0  IN     01 00                                               ..                     134.2.0        
  20.0  CTL    a1 84 00 08  00 06 10 00                            GET RES                135.1.0        
  20.0  IN     01 00                                               ..                     135.2.0        
  20.0  CTL    a1 87 00 08  00 06 10 00                            GET DEF                136.1.0        
  20.0  IN     00 00                                               ..                     136.2.0        
  20.0  CTL    a1 85 00 09  00 06 02 00                            GET LEN                137.1.0        
  20.0  IN     10 00                                               ..                     137.2.0        
  20.0  CTL    a1 86 00 09  00 06 01 00                            GET INFO               138.1.0        
  20.0  IN     03                                                  .                      138.2.0        
  20.0  CTL    a1 82 00 09  00 06 10 00                            GET MIN                139.1.0        
  20.0  IN     00                                                  .                      139.2.0        
  20.0  CTL    a1 83 00 09  00 06 10 00                            GET MAX                140.1.0        
  20.0  IN     01 00                                               ..                     140.2.0        
  20.0  CTL    a1 84 00 09  00 06 10 00                            GET RES                141.1.0        
  20.0  IN     01 00                                               ..                     141.2.0        
  20.0  CTL    a1 87 00 09  00 06 10 00                            GET DEF                142.1.0        
  20.0  IN     00 00                                               ..                     142.2.0        
  20.0  CTL    a1 85 00 0a  00 06 02 00                            GET LEN                143.1.0        
  20.0  IN     10 00                                               ..                     143.2.0        
  20.0  CTL    a1 86 00 0a  00 06 01 00                            GET INFO               144.1.0        
  20.0  IN     03                                                  .                      144.2.0        
  20.0  CTL    a1 82 00 0a  00 06 10 00                            GET MIN                145.1.0        
  20.0  IN     00                                                  .                      145.2.0        
  20.0  CTL    a1 83 00 0a  00 06 10 00                            GET MAX                146.1.0        
  20.0  IN     01 00                                               ..                     146.2.0        
  20.0  CTL    a1 84 00 0a  00 06 10 00                            GET RES                147.1.0        
  20.0  IN     01 00                                               ..                     147.2.0        
  20.0  CTL    a1 87 00 0a  00 06 10 00                            GET DEF                148.1.0        
  20.0  IN     00 00                                               ..                     148.2.0        
  20.0  CTL    a1 85 00 0b  00 06 02 00                            GET LEN                149.1.0        
  20.0  IN     20 00                                                .                     149.2.0        
  20.0  CTL    a1 86 00 0b  00 06 01 00                            GET INFO               150.1.0        
  20.0  IN     03                                                  .                      150.2.0        
  20.0  CTL    a1 82 00 0b  00 06 20 00                            GET MIN                151.1.0        
  20.0  IN     00                                                  .                      151.2.0        
  20.0  CTL    a1 83 00 0b  00 06 20 00                            GET MAX                152.1.0        
  20.0  IN     01 00                                               ..                     152.2.0        
  20.0  CTL    a1 84 00 0b  00 06 20 00                            GET RES                153.1.0        
  20.0  IN     01 00                                               ..                     153.2.0        
  20.0  CTL    a1 87 00 0b  00 06 20 00                            GET DEF                154.1.0        
  20.0  IN     00 00                                               ..                     154.2.0        
  20.0  CTL    a1 85 00 0c  00 06 02 00                            GET LEN                155.1.0        
  20.0  IN     20 00                                                .                     155.2.0        
  20.0  CTL    a1 86 00 0c  00 06 01 00                            GET INFO               156.1.0        
  20.0  IN     03                                                  .                      156.2.0        
  20.0  CTL    a1 82 00 0c  00 06 20 00                            GET MIN                157.1.0        
  20.0  IN     00                                                  .                      157.2.0        
  20.0  CTL    a1 83 00 0c  00 06 20 00                            GET MAX                158.1.0        
  20.0  IN     01 00                                               ..                     158.2.0        
  20.0  CTL    a1 84 00 0c  00 06 20 00                            GET RES                159.1.0        
  20.0  IN     01 00                                               ..                     159.2.0        
  20.0  CTL    a1 87 00 0c  00 06 20 00                            GET DEF                160.1.0        
  20.0  IN     00 00                                               ..                     160.2.0        
  20.0  CTL    a1 85 00 0e  00 06 02 00                            GET LEN                161.1.0        
  20.0  IN     10 00                                               ..                     161.2.0        
  20.0  CTL    a1 86 00 0e  00 06 01 00                            GET INFO               162.1.0        
  20.0  IN     03                                                  .                      162.2.0        
  20.0  CTL    a1 82 00 0e  00 06 10 00                            GET MIN                163.1.0        
  20.0  IN     00                                                  .                      163.2.0        
  20.0  CTL    a1 83 00 0e  00 06 10 00                            GET MAX                164.1.0        
  20.0  IN     01 00                                               ..                     164.2.0        
  20.0  CTL    a1 84 00 0e  00 06 10 00                            GET RES                165.1.0        
  20.0  IN     01 00                                               ..                     165.2.0        
  20.0  CTL    a1 87 00 0e  00 06 10 00                            GET DEF                166.1.0        
  20.0  IN     00 00                                               ..                     166.2.0        
  20.0  CTL    a1 85 00 0f  00 06 02 00                            GET LEN                167.1.0        
  20.0  IN     10 00                                               ..                     167.2.0        
  20.0  CTL    a1 86 00 0f  00 06 01 00                            GET INFO               168.1.0        
  20.0  IN     03                                                  .                      168.2.0        
  20.0  CTL    a1 82 00 0f  00 06 10 00                            GET MIN                169.1.0        
  20.0  IN     00                                                  .                      169.2.0        
  20.0  CTL    a1 83 00 0f  00 06 10 00                            GET MAX                170.1.0        
  20.0  IN     01 00                                               ..                     170.2.0        
  20.0  CTL    a1 84 00 0f  00 06 10 00                            GET RES                171.1.0        
  20.0  IN     01 00                                               ..                     171.2.0        
  20.0  CTL    a1 87 00 0f  00 06 10 00                            GET DEF                172.1.0        
  20.0  IN     00 00                                               ..                     172.2.0        
  20.0  CTL    a1 85 00 01  00 02 02 00                            GET LEN                173.1.0        
  20.0  IN     04 00                                               ..                     173.2.0        
  20.0  CTL    a1 86 00 01  00 02 01 00                            GET INFO               174.1.0        
  20.0  IN     03                                                  .                      174.2.0        
  20.0  CTL    a1 82 00 01  00 02 04 00                            GET MIN                175.1.0        
  20.0  IN     00                                                  .                      175.2.0        
  20.0  CTL    a1 83 00 01  00 02 04 00                            GET MAX                176.1.0        
  20.0  IN     01 00                                               ..                     176.2.0        
  20.0  CTL    a1 84 00 01  00 02 04 00                            GET RES                177.1.0        
  20.0  IN     01 00                                               ..                     177.2.0        
  20.0  CTL    a1 87 00 01  00 02 04 00                            GET DEF                178.1.0        
  20.0  IN     00 00                                               ..                     178.2.0        
  20.0  CTL    a1 85 00 02  00 02 02 00                            GET LEN                179.1.0        
  20.0  IN     04 00                                               ..                     179.2.0        
  20.0  CTL    a1 86 00 02  00 02 01 00                            GET INFO               180.1.0        
  20.0  IN     03                                                  .                      180.2.0        
  20.0  CTL    a1 82 00 02  00 02 04 00                            GET MIN                181.1.0        
  20.0  IN     00                                                  .                      181.2.0        
  20.0  CTL    a1 83 00 02  00 02 04 00                            GET MAX                182.1.0        
  20.0  IN     01 00                                               ..                     182.2.0        
  20.0  CTL    a1 84 00 02  00 02 04 00                            GET RES                183.1.0        
  20.0  IN     01 00                                               ..                     183.2.0        
  20.0  CTL    a1 87 00 02  00 02 04 00                            GET DEF                184.1.0        
  20.0  IN     00 00                                               ..                     184.2.0        
  20.0  CTL    a1 85 00 03  00 02 02 00                            GET LEN                185.1.0        
  20.0  IN     3c 00                                               <.                     185.2.0        
  20.0  CTL    a1 86 00 03  00 02 01 00                            GET INFO               186.1.0        
  20.0  IN     03                                                  .                      186.2.0        
  20.0  CTL    a1 82 00 03  00 02 3c 00                            GET MIN                187.1.0        
  20.0  IN     00                                                  .                      187.2.0        
  20.0  CTL    a1 83 00 03  00 02 3c 00                            GET MAX                188.1.0        
  20.0  IN     01 00                                               ..                     188.2.0        
  20.0  CTL    a1 84 00 03  00 02 3c 00                            GET RES                189.1.0        
  20.0  IN     01 00                                               ..                     189.2.0        
  20.0  CTL    a1 87 00 03  00 02 3c 00                            GET DEF                190.1.0        
  20.0  IN     00 00                                               ..                     190.2.0        
  20.0  CTL    a1 85 00 04  00 02 02 00                            GET LEN                191.1.0        
  20.0  IN     3c 00                                               <.                     191.2.0        
  20.0  CTL    a1 86 00 04  00 02 01 00                            GET INFO               192.1.0        
  20.0  IN     03                                                  .                      192.2.0        
  20.0  CTL    a1 82 00 04  00 02 3c 00                            GET MIN                193.1.0        
  20.0  IN     00                                                  .                      193.2.0        
  20.0  CTL    a1 83 00 04  00 02 3c 00                            GET MAX                194.1.0        
  20.0  IN     01 00                                               ..                     194.2.0        
  20.0  CTL    a1 84 00 04  00 02 3c 00                            GET RES                195.1.0        
  20.0  IN     01 00                                               ..                     195.2.0        
  20.0  CTL    a1 87 00 04  00 02 3c 00                            GET DEF                196.1.0        
  20.0  IN     00 00                                               ..                     196.2.0        
  20.0  CTL    a1 85 00 05  00 02 02 00                            GET LEN                197.1.0        
  20.0  USTS   c0000004                                            stall pid              197.2.0        
  20.0  CTL    a1 81 00 02  00 00 01 00                            GET CUR                198.1.0        
  20.0  IN     06                                                  .                      198.2.0        
  20.0  CTL    a1 85 00 06  00 02 02 00                            GET LEN                199.1.0        
  20.0  USTS   c0000004                                            stall pid              199.2.0        
  20.0  CTL    a1 81 00 02  00 00 01 00                            GET CUR                200.1.0        
  20.0  IN     06                                                  .                      200.2.0        
  20.0  CTL    a1 85 00 06  00 04 02 00                            GET LEN                201.1.0        
  20.0  IN     09 00                                               ..                     201.2.0        
  20.0  CTL    a1 86 00 06  00 04 01 00                            GET INFO               202.1.0        
  20.0  IN     03                                                  .                      202.2.0        
  20.0  CTL    a1 82 00 06  00 04 09 00                            GET MIN                203.1.0        
  20.0  IN     00 03 02 00  00 00 00 00  00                        .........              203.2.0        
  20.0  CTL    a1 83 00 06  00 04 09 00                            GET MAX                204.1.0        
  20.0  IN     01 03 02 00  00 00 00 00  00                        .........              204.2.0        
  20.0  CTL    a1 87 00 06  00 04 09 00                            GET DEF                205.1.0        
  20.0  IN     01 03 02 00  00 00 00 00  00                        .........              205.2.0        
  20.0  CTL    a1 84 00 06  00 04 09 00                            GET RES                206.1.0        
  20.0  IN     00 03 02 00  00 00 00 00  00                        .........              206.2.0        
  20.0  CTL    a1 85 00 09  00 04 02 00                            GET LEN                207.1.0        
  20.0  IN     04 00                                               ..                     207.2.0        
  20.0  CTL    a1 86 00 09  00 04 01 00                            GET INFO               208.1.0        
  20.0  IN     01                                                  .                      208.2.0        
  20.0  CTL    a1 82 00 09  00 04 04 00                            GET MIN                209.1.0        
  20.0  IN     10 00 00 00                                         ....                   209.2.0        
  20.0  CTL    a1 83 00 09  00 04 04 00                            GET MAX                210.1.0        
  20.0  IN     10 00 00 00                                         ....                   210.2.0        
  20.0  CTL    a1 87 00 09  00 04 04 00                            GET DEF                211.1.0        
  20.0  IN     10 00 00 00                                         ....                   211.2.0        
  20.0  CTL    a1 84 00 09  00 04 04 00                            GET RES                212.1.0        
  20.0  IN     00 00 00 00                                         ....                   212.2.0        
  20.0  CTL    a1 85 00 01  00 08 02 00                            GET LEN                213.1.0        
  20.0  IN     04 00                                               ..                     213.2.0        
  20.0  CTL    a1 86 00 01  00 08 01 00                            GET INFO               214.1.0        
  20.0  IN     01                                                  .                      214.2.0        
  20.0  CTL    a1 82 00 01  00 08 04 00                            GET MIN                215.1.0        
  20.0  IN     00 00 00 00                                         ....                   215.2.0        
  20.0  CTL    a1 83 00 01  00 08 04 00                            GET MAX                216.1.0        
  20.0  IN     ff ff ff ff                                         ....                   216.2.0        
  20.0  CTL    a1 84 00 01  00 08 04 00                            GET RES                217.1.0        
  20.0  IN     01 01 01 00                                         ....                   217.2.0        
  20.0  CTL    a1 87 00 01  00 08 04 00                            GET DEF                218.1.0        
  20.0  IN     00 00 00 00                                         ....                   218.2.0        
  20.0  CTL    a1 85 00 06  00 08 02 00                            GET LEN                219.1.0        
  20.0  IN     06 00                                               ..                     219.2.0        
  20.0  CTL    a1 86 00 06  00 08 01 00                            GET INFO               220.1.0        
  20.0  IN     03                                                  .                      220.2.0        
  20.0  CTL    a1 82 00 06  00 08 06 00                            GET MIN                221.1.0        
  20.0  IN     00 00 00 00  00 00                                  ......                 221.2.0        
  20.0  CTL    a1 83 00 06  00 08 06 00                            GET MAX                222.1.0        
  20.0  IN     ff ff ff ff  ff ff                                  ......                 222.2.0        
  20.0  CTL    a1 84 00 06  00 08 06 00                            GET RES                223.1.0        
  20.0  IN     01 00 01 00  01 00                                  ......                 223.2.0        
  20.0  CTL    a1 87 00 06  00 08 06 00                            GET DEF                224.1.0        
  20.0  IN     00 00 00 00  00 00                                  ......                 224.2.0        
  20.0  CTL    a1 85 00 07  00 08 02 00                            GET LEN                225.1.0        
  20.0  IN     0c 00                                               ..                     225.2.0        
  20.0  CTL    a1 86 00 07  00 08 01 00                            GET INFO               226.1.0        
  20.0  IN     03                                                  .                      226.2.0        
  20.0  CTL    a1 82 00 07  00 08 0c 00                            GET MIN                227.1.0        
  20.0  IN     20 20 20 20  20 20 20 20  20 20 20 20                                      227.2.0        
  20.0  CTL    a1 83 00 07  00 08 0c 00                            GET MAX                228.1.0        
  20.0  IN     7e 7e 7e 7e  7e 7e 7e 7e  7e 7e 7e 7e               ............           228.2.0        
  20.0  CTL    a1 84 00 07  00 08 0c 00                            GET RES                229.1.0        
  20.0  IN     01 01 01 01  01 01 01 01  01 01 01 01               ............           229.2.0        
  20.0  CTL    a1 87 00 07  00 08 0c 00                            GET DEF                230.1.0        
  20.0  IN     30 30 30 30  30 30 30 30  30 30 30 30               000000000000           230.2.0        
  20.0  CTL    a1 85 00 0f  00 08 02 00                            GET LEN                231.1.0        
  20.0  IN     20 00                                                .                     231.2.0        
  20.0  CTL    a1 86 00 0f  00 08 01 00                            GET INFO               232.1.0        
  20.0  IN     03                                                  .                      232.2.0        
  20.0  CTL    a1 82 00 0f  00 08 20 00                            GET MIN                233.1.0        
  20.0  IN     20 20 20 20  20 20 20 20  20 20 20 20  20 20 20 20                         233.2.0        
               20 20 20 20  20 20 20 20  20 20 20 20  20 20 20 20                         233.2.16       
  20.0  CTL    a1 83 00 0f  00 08 20 00                            GET MAX                234.1.0        
  20.0  IN     7e 7e 7e 7e  7e 7e 7e 7e  7e 7e 7e 7e  7e 7e 7e 7e  ................       234.2.0        
               7e 7e 7e 7e  7e 7e 7e 7e  7e 7e 7e 7e  7e 7e 7e 7e  ................       234.2.16       
  20.0  CTL    a1 84 00 0f  00 08 20 00                            GET RES                235.1.0        
  20.0  IN     01 01 01 01  01 01 01 01  01 01 01 01  01 01 01 01  ................       235.2.0        
               01 01 01 01  01 01 01 01  01 01 01 01  01 01 01 01  ................       235.2.16       
  20.0  CTL    a1 87 00 0f  00 08 20 00                            GET DEF                236.1.0        
  20.0  IN     4c 56 4e 65  78 74 00 00  00 00 00 00  00 00 00 00  LVNext..........       236.2.0        
               00 00 00 00  00 00 00 00  00 00 00 00  00 00 00 00  ................       236.2.16       
  20.0  CTL    a1 85 00 17  00 09 02 00                            GET LEN                237.1.0        
  20.0  IN     01 00                                               ..                     237.2.0        
  20.0  CTL    a1 86 00 17  00 09 01 00                            GET INFO               238.1.0        
  20.0  IN     03                                                  .                      238.2.0        
  20.0  CTL    a1 82 00 17  00 09 01 00                            GET MIN                239.1.0        
  20.0  IN     00                                                  .                      239.2.0        
  20.0  CTL    a1 83 00 17  00 09 01 00                            GET MAX                240.1.0        
  20.0  IN     ff                                                  .                      240.2.0        
  20.0  CTL    a1 84 00 17  00 09 01 00                            GET RES                241.1.0        
  20.0  IN     01                                                  .                      241.2.0        
  20.0  CTL    a1 87 00 17  00 09 01 00                            GET DEF                242.1.0        
  20.0  IN     00                                                  .                      242.2.0        
  20.0  CTL    a1 85 00 07  00 0b 02 00                            GET LEN                243.1.0        
  20.0  IN     03 00                                               ..                     243.2.0        
  20.0  CTL    a1 86 00 07  00 0b 01 00                            GET INFO               244.1.0        
  20.0  IN     03                                                  .                      244.2.0        
  20.0  CTL    a1 82 00 07  00 0b 03 00                            GET MIN                245.1.0        
  20.0  IN     00 00 00                                            ...                    245.2.0        
  20.0  CTL    a1 83 00 07  00 0b 03 00                            GET MAX                246.1.0        
  20.0  IN     ff ff ff                                            ...                    246.2.0        
  20.0  CTL    a1 84 00 07  00 0b 03 00                            GET RES                247.1.0        
  20.0  IN     01 01 01                                            ...                    247.2.0        
  20.0  CTL    a1 87 00 07  00 0b 03 00                            GET DEF                248.1.0        
  20.0  IN     00 00 00                                            ...                    248.2.0        
  20.0  CTL    a1 85 00 11  00 0b 02 00                            GET LEN                249.1.0        
  20.0  IN     01 00                                               ..                     249.2.0        
  20.0  CTL    a1 86 00 11  00 0b 01 00                            GET INFO               250.1.0        
  20.0  IN     02                                                  .                      250.2.0        
  20.0  CTL    a1 82 00 11  00 0b 01 00                            GET MIN                251.1.0        
  20.0  IN     00                                                  .                      251.2.0        
  20.0  CTL    a1 83 00 11  00 0b 01 00                            GET MAX                252.1.0        
  20.0  IN     01                                                  .                      252.2.0        
  20.0  CTL    a1 84 00 11  00 0b 01 00                            GET RES                253.1.0        
  20.0  IN     01                                                  .                      253.2.0        
  20.0  CTL    a1 87 00 11  00 0b 01 00                            GET DEF                254.1.0        
  20.0  IN     00                                                  .                      254.2.0        
  20.0  CTL    a1 85 00 01  00 0c 02 00                            GET LEN                255.1.0        
  20.0  IN     08 00                                               ..                     255.2.0        
  20.0  CTL    a1 86 00 01  00 0c 01 00                            GET INFO               256.1.0        
  20.0  IN     03                                                  .                      256.2.0        
  20.0  CTL    a1 82 00 01  00 0c 08 00                            GET MIN                257.1.0        
  20.0  IN     00 00 00 00  00 00 00 00                            ........               257.2.0        
  20.0  CTL    a1 83 00 01  00 0c 08 00                            GET MAX                258.1.0        
  20.0  IN     04 00 00 00  64 00 00 00                            ....d...               258.2.0        
  20.0  CTL    a1 84 00 01  00 0c 08 00                            GET RES                259.1.0        
  20.0  IN     01 00 00 00  01 00 00 00                            ........               259.2.0        
  20.0  CTL    a1 87 00 01  00 0c 08 00                            GET DEF                260.1.0        
  20.0  IN     00 00 00 00  32 00 00 00                            ....2...               260.2.0        
  20.0  CTL    a1 85 00 02  00 0c 02 00                            GET LEN                261.1.0        
  20.0  IN     08 00                                               ..                     261.2.0        
  20.0  CTL    a1 86 00 02  00 0c 01 00                            GET INFO               262.1.0        
  20.0  IN     03                                                  .                      262.2.0        
  20.0  CTL    a1 82 00 02  00 0c 08 00                            GET MIN                263.1.0        
  20.0  IN     00 00 00 00  00 00 00 00                            ........               263.2.0        
  20.0  CTL    a1 83 00 02  00 0c 08 00                            GET MAX                264.1.0        
  20.0  IN     04 00 00 00  02 00 00 00                            ........               264.2.0        
  20.0  CTL    a1 84 00 02  00 0c 08 00                            GET RES                265.1.0        
  20.0  IN     01 00 00 00  01 00 00 00                            ........               265.2.0        
  20.0  CTL    a1 87 00 02  00 0c 08 00                            GET DEF                266.1.0        
  20.0  IN     00 00 00 00  00 00 00 00                            ........               266.2.0        
  20.0  CTL    a1 85 00 03  00 0c 02 00                            GET LEN                267.1.0        
  20.0  IN     04 00                                               ..                     267.2.0        
  20.0  CTL    a1 86 00 03  00 0c 01 00                            GET INFO               268.1.0        
  20.0  IN     03                                                  .                      268.2.0        
  20.0  CTL    a1 82 00 03  00 0c 04 00                            GET MIN                269.1.0        
  20.0  IN     00 00 00 00                                         ....                   269.2.0        
  20.0  CTL    a1 83 00 03  00 0c 04 00                            GET MAX                270.1.0        
  20.0  IN     64 00 00 00                                         d...                   270.2.0        
  20.0  CTL    a1 84 00 03  00 0c 04 00                            GET RES                271.1.0        
  20.0  IN     01 00 00 00                                         ....                   271.2.0        
  20.0  CTL    a1 87 00 03  00 0c 04 00                            GET DEF                272.1.0        
  20.0  IN     32 00 00 00                                         2...                   272.2.0        
  20.0  CTL    a1 85 00 04  00 0c 02 00                            GET LEN                273.1.0        
  20.0  IN     04 00                                               ..                     273.2.0        
  20.0  CTL    a1 86 00 04  00 0c 01 00                            GET INFO               274.1.0        
  20.0  IN     03                                                  .                      274.2.0        
  20.0  CTL    a1 82 00 04  00 0c 04 00                            GET MIN                275.1.0        
  20.0  IN     00 00 00 00                                         ....                   275.2.0        
  20.0  CTL    a1 83 00 04  00 0c 04 00                            GET MAX                276.1.0        
  20.0  IN     64 00 00 00                                         d...                   276.2.0        
  20.0  CTL    a1 84 00 04  00 0c 04 00                            GET RES                277.1.0        
  20.0  IN     01 00 00 00                                         ....                   277.2.0        
  20.0  CTL    a1 87 00 04  00 0c 04 00                            GET DEF                278.1.0        
  20.0  IN     32 00 00 00                                         2...                   278.2.0        
  20.0  CTL    a1 85 00 01  00 0d 02 00                            GET LEN                279.1.0        
  20.0  IN     0c 00                                               ..                     279.2.0        
  20.0  CTL    a1 86 00 01  00 0d 01 00                            GET INFO               280.1.0        
  20.0  IN     03                                                  .                      280.2.0        
  20.0  CTL    a1 82 00 01  00 0d 0c 00                            GET MIN                281.1.0        
  20.0  IN     00 00 00 00  00 00 00 00  00 00 00 00               ............           281.2.0        
  20.0  CTL    a1 83 00 01  00 0d 0c 00                            GET MAX                282.1.0        
  20.0  IN     00 00 00 00  00 e1 f5 05  01 00 0f 00               ............           282.2.0        
  20.0  CTL    a1 84 00 01  00 0d 0c 00                            GET RES                283.1.0        
  20.0  IN     01 00 00 00  01 00 00 00  01 00 01 00               ............           283.2.0        
  20.0  CTL    a1 87 00 01  00 0d 0c 00                            GET DEF                284.1.0        
  20.0  IN     00 00 00 00  00 00 00 00  00 00 00 00               ............           284.2.0        
  20.0  CTL    a1 85 00 02  00 0d 02 00                            GET LEN                285.1.0        
  20.0  IN     0c 00                                               ..                     285.2.0        
  20.0  CTL    a1 86 00 02  00 0d 01 00                            GET INFO               286.1.0        
  20.0  IN     03                                                  .                      286.2.0        
  20.0  CTL    a1 82 00 02  00 0d 0c 00                            GET MIN                287.1.0        
  20.0  IN     00 00 00 00  00 00 00 00  00 00 00 00               ............           287.2.0        
  20.0  CTL    a1 83 00 02  00 0d 0c 00                            GET MAX                288.1.0        
  20.0  IN     00 00 00 00  00 e1 f5 05  01 00 0f 00               ............           288.2.0        
  20.0  CTL    a1 84 00 02  00 0d 0c 00                            GET RES                289.1.0        
  20.0  IN     01 00 00 00  01 00 00 00  01 00 01 00               ............           289.2.0        
  20.0  CTL    a1 87 00 02  00 0d 0c 00                            GET DEF                290.1.0        
  20.0  IN     00 00 00 00  00 00 00 00  00 00 00 00               ............           290.2.0        
  20.0  CTL    a1 85 00 03  00 0d 02 00                            GET LEN                291.1.0        
  20.0  IN     0c 00                                               ..                     291.2.0        
  20.0  CTL    a1 86 00 03  00 0d 01 00                            GET INFO               292.1.0        
  20.0  IN     03                                                  .                      292.2.0        
  20.0  CTL    a1 82 00 03  00 0d 0c 00                            GET MIN                293.1.0        
  20.0  IN     00 00 00 00  00 00 00 00  00 00 00 00               ............           293.2.0        
  20.0  CTL    a1 83 00 03  00 0d 0c 00                            GET MAX                294.1.0        
  20.0  IN     00 00 00 00  00 e1 f5 05  01 00 0f 00               ............           294.2.0        
  20.0  CTL    a1 84 00 03  00 0d 0c 00                            GET RES                295.1.0        
  20.0  IN     01 00 00 00  01 00 00 00  01 00 01 00               ............           295.2.0        
  20.0  CTL    a1 87 00 03  00 0d 0c 00                            GET DEF                296.1.0        
  20.0  IN     00 00 00 00  00 00 00 00  00 00 00 00               ............           296.2.0        
  20.0  CTL    a1 85 00 04  00 0d 02 00                            GET LEN                297.1.0        
  20.0  IN     08 00                                               ..                     297.2.0        
  20.0  CTL    a1 86 00 04  00 0d 01 00                            GET INFO               298.1.0        
  20.0  IN     03                                                  .                      298.2.0        
  20.0  CTL    a1 82 00 04  00 0d 08 00                            GET MIN                299.1.0        
  20.0  IN     00 00 00 00  00 00 00 00                            ........               299.2.0        
  20.0  CTL    a1 83 00 04  00 0d 08 00                            GET MAX                300.1.0        
  20.0  IN     00 00 00 00  00 e1 f5 05                            ........               300.2.0        
  20.0  CTL    a1 84 00 04  00 0d 08 00                            GET RES                301.1.0        
  20.0  IN     01 00 00 00  01 00 00 00                            ........               301.2.0        
  20.0  CTL    a1 87 00 04  00 0d 08 00                            GET DEF                302.1.0        
  20.0  IN     00 00 00 00  00 00 00 00                            ........               302.2.0        
  20.0  CTL    a1 85 00 05  00 0d 02 00                            GET LEN                303.1.0        
  20.0  IN     0c 00                                               ..                     303.2.0        
  20.0  CTL    a1 86 00 05  00 0d 01 00                            GET INFO               304.1.0        
  20.0  IN     03                                                  .                      304.2.0        
  20.0  CTL    a1 82 00 05  00 0d 0c 00                            GET MIN                305.1.0        
  20.0  IN     00 00 00 00  00 00 00 00  00 00 00 00               ............           305.2.0        
  20.0  CTL    a1 83 00 05  00 0d 0c 00                            GET MAX                306.1.0        
  20.0  IN     00 00 00 00  00 e1 f5 05  00 00 00 00               ............           306.2.0        
  20.0  CTL    a1 84 00 05  00 0d 0c 00                            GET RES                307.1.0        
  20.0  IN     01 00 00 00  01 00 00 00  00 00 00 00               ............           307.2.0        
  20.0  CTL    a1 87 00 05  00 0d 0c 00                            GET DEF                308.1.0        
  20.0  IN     00 00 00 00  00 00 00 00  00 00 00 00               ............           308.2.0        
  21.0  CTL    80 06 00 01  00 00 12 00                            GET DESCRIPTOR         309.1.0        
  21.0  IN     12 01 20 03  ef 02 01 09  6d 04 4f 09  99 99 01 08  .. .....m.O.....       309.2.0        
               03 01                                               ..                     309.2.16       
  21.0  CTL    80 06 00 02  00 00 09 00                            GET DESCRIPTOR         310.1.0        
  21.0  IN     09 02 60 02  02 01 04 c0  00                        ..`......              310.2.0        
  21.0  CTL    80 06 00 02  00 00 60 02                            GET DESCRIPTOR         311.1.0        
  21.0  IN     09 02 60 02  02 01 04 c0  00 09 04 02  00 00 0e 01  ..`.............       311.2.0        
               00 08 0d 24  01 10 01 2a  01 00 6c dc  02 01 03 12  ...$...*..l.....       311.2.16       
  21.0  CTL    00 09 01 00  00 00 00 00                            SET CONFIG             312.1.0        
  21.0  CTL    01 0b 00 00  03 00 00 00                            SET INTERFACE          313.1.0        
  21.0  CTL    a1 85 00 06  02 04 02 00                            GET LEN                314.1.0        
  21.0  IN     09 00                                               ..                     314.2.0        
  21.0  CTL    a1 86 00 06  02 04 01 00                            GET INFO               315.1.0        
  21.0  IN     03                                                  .                      315.2.0        
  21.0  CTL    a1 82 00 06  02 04 09 00                            GET MIN                316.1.0        
  21.0  IN     00 03 02 00  00 00 00 00  00                        .........              316.2.0        
  21.0  CTL    a1 83 00 06  02 04 09 00                            GET MAX                317.1.0        
  21.0  IN     01 03 02 00  00 00 00 00  00                        .........              317.2.0        
  21.0  CTL    a1 87 00 06  02 04 09 00                            GET DEF                318.1.0        
  21.0  IN     01 03 02 00  00 00 00 00  00                        .........              318.2.0        
  21.0  CTL    a1 84 00 06  02 04 09 00                            GET RES                319.1.0        
  21.0  IN     00 03 02 00  00 00 00 00  00                        .........              319.2.0        
  21.0  CTL    21 01 00 06  02 04 09 00                            SET CUR                320.1.0        
  21.0  OUT    01 03 02 00  00 00 00 00  00                        .........              320.2.0        
  21.0  CTL    a1 85 00 09  02 04 02 00                            GET LEN                321.1.0        
  21.0  IN     04 00                                               ..                     321.2.0        
  21.0  CTL    a1 86 00 09  02 04 01 00                            GET INFO               322.1.0        
  21.0  IN     01                                                  .                      322.2.0        
  21.0  CTL    a1 82 00 09  02 04 04 00                            GET MIN                323.1.0        
  21.0  IN     10 00 00 00                                         ....                   323.2.0        
  21.0  CTL    a1 83 00 09  02 04 04 00                            GET MAX                324.1.0        
  21.0  IN     10 00 00 00                                         ....                   324.2.0        
  21.0  CTL    a1 87 00 09  02 04 04 00                            GET DEF                325.1.0        
  21.0  IN     10 00 00 00                                         ....                   325.2.0        
  21.0  CTL    a1 84 00 09  02 04 04 00                            GET RES                326.1.0        
  21.0  IN     00 00 00 00                                         ....                   326.2.0        
  21.0  CTL    a1 85 00 01  02 0c 02 00                            GET LEN                327.1.0        
  21.0  IN     08 00                                               ..                     327.2.0        
  21.0  CTL    a1 86 00 01  02 0c 01 00                            GET INFO               328.1.0        
  21.0  IN     03                                                  .                      328.2.0        
  21.0  CTL    a1 82 00 01  02 0c 08 00                            GET MIN                329.1.0        
  21.0  IN     00 00 00 00  00 00 00 00                            ........               329.2.0        
  21.0  CTL    a1 83 00 01  02 0c 08 00                            GET MAX                330.1.0        
  21.0  IN     04 00 00 00  64 00 00 00                            ....d...               330.2.0        
  21.0  CTL    a1 84 00 01  02 0c 08 00                            GET RES                331.1.0        
  21.0  IN     01 00 00 00  01 00 00 00                            ........               331.2.0        
  21.0  CTL    a1 87 00 01  02 0c 08 00                            GET DEF                332.1.0        
  21.0  IN     00 00 00 00  32 00 00 00                            ....2...               332.2.0        
  21.0  CTL    a1 85 00 02  02 0c 02 00                            GET LEN                333.1.0        
  21.0  IN     08 00                                               ..                     333.2.0        
  21.0  CTL    a1 86 00 02  02 0c 01 00                            GET INFO               334.1.0        
  21.0  IN     03                                                  .                      334.2.0        
  21.0  CTL    a1 82 00 02  02 0c 08 00                            GET MIN                335.1.0        
  21.0  IN     00 00 00 00  00 00 00 00                            ........               335.2.0        
  21.0  CTL    a1 83 00 02  02 0c 08 00                            GET MAX                336.1.0        
  21.0  IN     04 00 00 00  02 00 00 00                            ........               336.2.0        
  21.0  CTL    a1 84 00 02  02 0c 08 00                            GET RES                337.1.0        
  21.0  IN     01 00 00 00  01 00 00 00                            ........               337.2.0        
  21.0  CTL    a1 87 00 02  02 0c 08 00                            GET DEF                338.1.0        
  21.0  IN     00 00 00 00  00 00 00 00                            ........               338.2.0        
  21.0  CTL    a1 85 00 03  02 0c 02 00                            GET LEN                339.1.0        
  21.0  IN     04 00                                               ..                     339.2.0        
  21.0  CTL    a1 86 00 03  02 0c 01 00                            GET INFO               340.1.0        
  21.0  IN     03                                                  .                      340.2.0        
  21.0  CTL    a1 82 00 03  02 0c 04 00                            GET MIN                341.1.0        
  21.0  IN     00 00 00 00                                         ....                   341.2.0        
  21.0  CTL    a1 83 00 03  02 0c 04 00                            GET MAX                342.1.0        
  21.0  IN     64 00 00 00                                         d...                   342.2.0        
  21.0  CTL    a1 84 00 03  02 0c 04 00                            GET RES                343.1.0        
  21.0  IN     01 00 00 00                                         ....                   343.2.0        
  21.0  CTL    a1 87 00 03  02 0c 04 00                            GET DEF                344.1.0        
  21.0  IN     32 00 00 00                                         2...                   344.2.0        
  21.0  CTL    a1 85 00 04  02 0c 02 00                            GET LEN                345.1.0        
  21.0  IN     04 00                                               ..                     345.2.0        
  21.0  CTL    a1 86 00 04  02 0c 01 00                            GET INFO               346.1.0        
  21.0  IN     03                                                  .                      346.2.0        
  21.0  CTL    a1 82 00 04  02 0c 04 00                            GET MIN                347.1.0        
  21.0  IN     00 00 00 00                                         ....                   347.2.0        
  21.0  CTL    a1 83 00 04  02 0c 04 00                            GET MAX                348.1.0        
  21.0  IN     64 00 00 00                                         d...                   348.2.0        
  21.0  CTL    a1 84 00 04  02 0c 04 00                            GET RES                349.1.0        
  21.0  IN     01 00 00 00                                         ....                   349.2.0        
  21.0  CTL    a1 87 00 04  02 0c 04 00                            GET DEF                350.1.0        
  21.0  IN     32 00 00 00                                         2...                   350.2.0        
  21.0  CTL    a1 85 00 01  02 0d 02 00                            GET LEN                351.1.0        
  21.0  IN     0c 00                                               ..                     351.2.0        
  21.0  CTL    a1 86 00 01  02 0d 01 00                            GET INFO               352.1.0        
  21.0  IN     03                                                  .                      352.2.0        
  21.0  CTL    a1 82 00 01  02 0d 0c 00                            GET MIN                353.1.0        
  21.0  IN     00 00 00 00  00 00 00 00  00 00 00 00               ............           353.2.0        
  21.0  CTL    a1 83 00 01  02 0d 0c 00                            GET MAX                354.1.0        
  21.0  IN     00 00 00 00  00 e1 f5 05  01 00 0f 00               ............           354.2.0        
  21.0  CTL    a1 84 00 01  02 0d 0c 00                            GET RES                355.1.0        
  21.0  IN     01 00 00 00  01 00 00 00  01 00 01 00               ............           355.2.0        
  21.0  CTL    a1 87 00 01  02 0d 0c 00                            GET DEF                356.1.0        
  21.0  IN     00 00 00 00  00 00 00 00  00 00 00 00               ............           356.2.0        
  21.0  CTL    a1 85 00 02  02 0d 02 00                            GET LEN                357.1.0        
  21.0  IN     0c 00                                               ..                     357.2.0        
  21.0  CTL    a1 86 00 02  02 0d 01 00                            GET INFO               358.1.0        
  21.0  IN     03                                                  .                      358.2.0        
  21.0  CTL    a1 82 00 02  02 0d 0c 00                            GET MIN                359.1.0        
  21.0  IN     00 00 00 00  00 00 00 00  00 00 00 00               ............           359.2.0        
  21.0  CTL    a1 83 00 02  02 0d 0c 00                            GET MAX                360.1.0        
  21.0  IN     00 00 00 00  00 e1 f5 05  01 00 0f 00               ............           360.2.0        
  21.0  CTL    a1 84 00 02  02 0d 0c 00                            GET RES                361.1.0        
  21.0  IN     01 00 00 00  01 00 00 00  01 00 01 00               ............           361.2.0        
  21.0  CTL    a1 87 00 02  02 0d 0c 00                            GET DEF                362.1.0        
  21.0  IN     00 00 00 00  00 00 00 00  00 00 00 00               ............           362.2.0        
  21.0  CTL    a1 85 00 03  02 0d 02 00                            GET LEN                363.1.0        
  21.0  IN     0c 00                                               ..                     363.2.0        
  21.0  CTL    a1 86 00 03  02 0d 01 00                            GET INFO               364.1.0        
  21.0  IN     03                                                  .                      364.2.0        
  21.0  CTL    a1 82 00 03  02 0d 0c 00                            GET MIN                365.1.0        
  21.0  IN     00 00 00 00  00 00 00 00  00 00 00 00               ............           365.2.0        
  21.0  CTL    a1 83 00 03  02 0d 0c 00                            GET MAX                366.1.0        
  21.0  IN     00 00 00 00  00 e1 f5 05  01 00 0f 00               ............           366.2.0        
  21.0  CTL    a1 84 00 03  02 0d 0c 00                            GET RES                367.1.0        
  21.0  IN     01 00 00 00  01 00 00 00  01 00 01 00               ............           367.2.0        
  21.0  CTL    a1 87 00 03  02 0d 0c 00                            GET DEF                368.1.0        
  21.0  IN     00 00 00 00  00 00 00 00  00 00 00 00               ............           368.2.0        
  21.0  CTL    a1 85 00 04  02 0d 02 00                            GET LEN                369.1.0        
  21.0  IN     08 00                                               ..                     369.2.0        
  21.0  CTL    a1 86 00 04  02 0d 01 00                            GET INFO               370.1.0        
  21.0  IN     03                                                  .                      370.2.0        
  21.0  CTL    a1 82 00 04  02 0d 08 00                            GET MIN                371.1.0        
  21.0  IN     00 00 00 00  00 00 00 00                            ........               371.2.0        
  21.0  CTL    a1 83 00 04  02 0d 08 00                            GET MAX                372.1.0        
  21.0  IN     00 00 00 00  00 e1 f5 05                            ........               372.2.0        
  21.0  CTL    a1 84 00 04  02 0d 08 00                            GET RES                373.1.0        
  21.0  IN     01 00 00 00  01 00 00 00                            ........               373.2.0        
  21.0  CTL    a1 87 00 04  02 0d 08 00                            GET DEF                374.1.0        
  21.0  IN     00 00 00 00  00 00 00 00                            ........               374.2.0        
  21.0  CTL    a1 85 00 05  02 0d 02 00                            GET LEN                375.1.0        
  21.0  IN     0c 00                                               ..                     375.2.0        
  21.0  CTL    a1 86 00 05  02 0d 01 00                            GET INFO               376.1.0        
  21.0  IN     03                                                  .                      376.2.0        
  21.0  CTL    a1 82 00 05  02 0d 0c 00                            GET MIN                377.1.0        
  21.0  IN     00 00 00 00  00 00 00 00  00 00 00 00               ............           377.2.0        
  21.0  CTL    a1 83 00 05  02 0d 0c 00                            GET MAX                378.1.0        
  21.0  IN     00 00 00 00  00 e1 f5 05  00 00 00 00               ............           378.2.0        
  21.0  CTL    a1 84 00 05  02 0d 0c 00                            GET RES                379.1.0        
  21.0  IN     01 00 00 00  01 00 00 00  00 00 00 00               ............           379.2.0        
  21.0  CTL    a1 87 00 05  02 0d 0c 00                            GET DEF                380.1.0        
  21.0  IN     00 00 00 00  00 00 00 00  00 00 00 00               ............           380.2.0        
  21.0  CTL    a1 81 00 06  02 04 09 00                            GET CUR                381.1.0(4)     
  21.0  IN     01 03 02 00  00 00 00 00  00                        .........              381.2.0        
  21.0  CTL    21 01 00 06  02 04 09 00                            SET CUR                382.1.0(4)     
  21.0  OUT    01 03 02 00  00 00 00 00  00                        .........              382.2.0        
  21.0  CTL    a1 81 00 06  02 04 09 00                            GET CUR                389.1.0        
  21.0  IN     01 03 02 00  00 00 00 00  00                        .........              389.2.0        
  21.0  CTL    a1 83 00 09  02 04 04 00                            GET MAX                390.1.0        
  21.0  IN     10 00 00 00                                         ....                   390.2.0        
  21.0  CTL    a1 81 00 01  03 00 22 00                            GET CUR                391.1.0        
  21.0  IN     01 00 01 01  15 16 05 00  00 00 00 00  00 00 00 00  ................       391.2.0        
               00 00 90 c3  01 00 b2 01  00 00 00 00  00 00 03 01  ................       391.2.16       
  21.0  CTL    21 01 00 01  03 00 22 00                            SET CUR                392.1.0        
  21.0  OUT    01 00 01 01  15 16 05 00  00 00 00 00  00 00 00 00  ................       392.2.0        
               00 00 90 c3  01 00 00 00  00 00 00 00  00 00 03 01  ................       392.2.16       
  21.0  CTL    a1 81 00 01  03 00 22 00                            GET CUR                393.1.0        
  21.0  IN     01 00 01 01  15 16 05 00  00 00 00 00  00 00 00 00  ................       393.2.0        
               00 00 90 c3  01 00 b2 01  00 00 00 00  00 00 03 01  ................       393.2.16       
  21.0  CTL    a1 83 00 01  03 00 22 00                            GET MAX                394.1.0        
  21.0  IN     01 00 01 01  15 16 05 00  00 00 00 00  00 00 00 00  ................       394.2.0        
               00 00 90 c3  01 00 b2 01  00 00 00 00  00 00 03 01  ................       394.2.16       
  21.0  CTL    a1 82 00 01  03 00 22 00                            GET MIN                395.1.0        
  21.0  IN     01 00 01 01  15 16 05 00  00 00 00 00  00 00 00 00  ................       395.2.0        
               00 00 90 c3  01 00 b2 01  00 00 00 00  00 00 03 01  ................       395.2.16       
  21.0  CTL    a1 83 00 09  02 04 04 00                            GET MAX                396.1.0        
  21.0  IN     10 00 00 00                                         ....                   396.2.0        
  21.0  CTL    21 01 00 01  03 00 22 00                            SET CUR                397.1.0        
  21.0  OUT    01 00 01 01  15 16 05 00  00 00 00 00  00 00 00 00  ................       397.2.0        
               00 00 90 c3  01 00 00 00  00 00 00 00  00 00 03 01  ................       397.2.16       
  21.0  CTL    a1 81 00 01  03 00 22 00                            GET CUR                398.1.0        
  21.0  IN     01 00 01 01  15 16 05 00  00 00 00 00  00 00 00 00  ................       398.2.0        
               00 00 90 c3  01 00 b2 01  00 00 00 00  00 00 03 01  ................       398.2.16       
  21.0  CTL    21 01 00 02  03 00 22 00                            SET CUR                399.1.0        
  21.0  OUT    01 00 01 01  15 16 05 00  00 00 00 00  00 00 00 00  ................       399.2.0        
               00 00 90 c3  01 00 b2 01  00 00 00 00  00 00 03 01  ................       399.2.16       
  21.0  CTL    01 0b 04 00  03 00 00 00                            SET INTERFACE          400.1.0        
  20.0  CTL    a1 83 00 09  00 04 04 00                            GET MAX                401.1.0        
  20.0  IN     10 00 00 00                                         ....                   401.2.0        
  20.0  CTL    a1 81 00 01  01 00 30 00                            GET CUR                402.1.0        
  20.0  IN     01 00 01 01  0a 8b 02 00  00 00 00 00  00 00 00 00  ................       402.2.0        
               00 00 00 b0  04 00 01 09  00 00 00 00  00 00 03 01  ................       402.2.16       
  20.0  CTL    21 01 00 01  01 00 30 00                            SET CUR                403.1.0        
  20.0  OUT    01 00 01 04  15 16 05 00  00 00 00 00  00 00 00 00  ................       403.2.0        
               00 00 00 b0  04 00 00 00  00 00 00 00  00 00 03 01  ................       403.2.16       
  20.0  CTL    a1 81 00 01  01 00 30 00                            GET CUR                404.1.0        
  20.0  IN     01 00 01 04  15 16 05 00  00 00 00 00  00 00 00 00  ................       404.2.0        
               00 00 00 90  7e 00 81 79  00 00 00 00  00 00 03 01  .......y........       404.2.16       
  20.0  CTL    a1 83 00 01  01 00 30 00                            GET MAX                405.1.0        
  20.0  IN     01 00 01 04  15 16 05 00  00 00 00 00  00 00 00 00  ................       405.2.0        
               00 00 00 90  7e 00 81 79  00 00 00 00  00 00 03 01  .......y........       405.2.16       
  20.0  CTL    a1 82 00 01  01 00 30 00                            GET MIN                406.1.0        
  20.0  IN     01 00 01 04  15 16 05 00  00 00 00 00  00 00 00 00  ................       406.2.0        
               00 00 00 90  7e 00 81 79  00 00 00 00  00 00 03 01  .......y........       406.2.16       
  20.0  CTL    a1 83 00 09  00 04 04 00                            GET MAX                407.1.0        
  20.0  IN     10 00 00 00                                         ....                   407.2.0        
  20.0  CTL    21 01 00 01  01 00 30 00                            SET CUR                408.1.0        
  20.0  OUT    01 00 01 04  15 16 05 00  00 00 00 00  00 00 00 00  ................       408.2.0        
               00 00 00 90  7e 00 00 00  00 00 00 00  00 00 03 01  ................       408.2.16       
  20.0  CTL    a1 81 00 01  01 00 30 00                            GET CUR                409.1.0        
  20.0  IN     01 00 01 04  15 16 05 00  00 00 00 00  00 00 00 00  ................       409.2.0        
               00 00 00 90  7e 00 81 79  00 00 00 00  00 00 03 01  .......y........       409.2.16       
  20.0  CTL    21 01 00 02  01 00 30 00                            SET CUR                410.1.0        
  20.0  OUT    01 00 01 04  15 16 05 00  00 00 00 00  00 00 00 00  ................       410.2.0        
               00 00 00 90  7e 00 81 79  00 00 00 00  00 00 03 01  .......y........       410.2.16       
  20.0  CTL    01 0b 12 00  01 00 00 00                            SET INTERFACE          411.1.0        
